Student Name,Score,Feedback,Rubric
Harper Taylor,Not submitted,No file received.,
Noah Kim,Not submitted,No file received.,
Jacob Miller,59,This work does not meet assignment requirements. Review the rubric carefully and seek help from the writing center.,Thesis → Developing | Organization → Needs Improvement | Evidence → Developing
Logan Martinez,46,Significant gaps in understanding are evident. Please see me after class to develop a plan for catching up.,Thesis → Needs Improvement | Organization → Developing | Evidence → Needs Improvement
Ava Patel,90,Outstanding work! Your analysis demonstrates deep understanding of the material. Keep up this exceptional effort!,Thesis → Excellent | Organization → Advanced | Evidence → Excellent
Lucas Anderson,93,Excellent submission! Your arguments are well-structured and thoroughly supported with evidence.,Thesis → Advanced | Organization → Excellent | Evidence → Advanced
Sophia Rodriguez,85,Good job! Your ideas are clear and well-presented. Focus on deeper analysis in future work.,Thesis → Proficient | Organization → Good | Evidence → Proficient
Ethan Williams,75,Nice work! You demonstrate good understanding. Work on transitions between paragraphs for better flow.,Thesis → Good | Organization → Proficient | Evidence → Good
Liam Chen,71,Satisfactory work. You understand the basics but need to develop your ideas more fully. Review the rubric for areas to improve.,Thesis → Proficient | Organization → Good | Evidence → Proficient
Charlotte Wilson,96,Excellent submission! Your arguments are well-structured and thoroughly supported with evidence.,Thesis → Advanced | Organization → Excellent | Evidence → Advanced
Mia Davis,90,Exceptional performance! You've mastered the key concepts and presented them beautifully.,Thesis → Excellent | Organization → Advanced | Evidence → Excellent
Emma Johnson,80,Nice work! You demonstrate good understanding. Work on transitions between paragraphs for better flow.,Thesis → Good | Organization → Proficient | Evidence → Good
Amelia Brown,85,Strong work overall! Your understanding is solid. Consider adding more specific examples to strengthen your arguments.,Thesis → Proficient | Organization → Good | Evidence → Proficient
Mason Lee,71,Adequate submission. Focus on providing more detailed explanations and supporting evidence.,Thesis → Good | Organization → Proficient | Evidence → Good
Isabella Thompson,93,Exceptional performance! You've mastered the key concepts and presented them beautifully.,Thesis → Excellent | Organization → Advanced | Evidence → Excellent
