Student Name,Score,Feedback,Rubric
Isabella Thompson,Not submitted,No file received.,
Ava Patel,Not submitted,No file received.,
Jacob Miller,59,This work does not meet assignment requirements. Review the rubric carefully and seek help from the writing center.,Argument → Developing | Structure → Needs Improvement | Evidence → Developing
Mia Davis,46,Significant gaps in understanding are evident. Please see me after class to develop a plan for catching up.,Argument → Needs Improvement | Structure → Developing | Evidence → Needs Improvement
Noah Kim,90,Outstanding work! Your analysis demonstrates deep understanding of the material. Keep up this exceptional effort!,Argument → Excellent | Structure → Advanced | Evidence → Excellent
Mason Lee,93,Excellent submission! Your arguments are well-structured and thoroughly supported with evidence.,Argument → Advanced | Structure → Excellent | Evidence → Advanced
Logan Martinez,85,Good job! Your ideas are clear and well-presented. Focus on deeper analysis in future work.,Argument → Proficient | Structure → Good | Evidence → Proficient
Lucas Anderson,75,Nice work! You demonstrate good understanding. Work on transitions between paragraphs for better flow.,Argument → Good | Structure → Proficient | Evidence → Good
Amelia Brown,71,Satisfactory work. You understand the basics but need to develop your ideas more fully. Review the rubric for areas to improve.,Argument → Proficient | Structure → Good | Evidence → Proficient
Sophia Rodriguez,96,Excellent submission! Your arguments are well-structured and thoroughly supported with evidence.,Argument → Advanced | Structure → Excellent | Evidence → Advanced
Charlotte Wilson,90,Exceptional performance! You've mastered the key concepts and presented them beautifully.,Argument → Excellent | Structure → Advanced | Evidence → Excellent
Liam Chen,80,Nice work! You demonstrate good understanding. Work on transitions between paragraphs for better flow.,Argument → Good | Structure → Proficient | Evidence → Good
Emma Johnson,85,Strong work overall! Your understanding is solid. Consider adding more specific examples to strengthen your arguments.,Argument → Proficient | Structure → Good | Evidence → Proficient
Harper Taylor,71,Adequate submission. Focus on providing more detailed explanations and supporting evidence.,Argument → Good | Structure → Proficient | Evidence → Good
Ethan Williams,93,Exceptional performance! You've mastered the key concepts and presented them beautifully.,Argument → Excellent | Structure → Advanced | Evidence → Excellent
